{
  "$schema": "https://json-schema.org/draft/2020-12/schema",
  "$id": "https://openclaw.local/schemas/strategy_spec.schema.json",
  "title": "StrategySpec",
  "type": "object",
  "additionalProperties": false,
  "required": ["schema_version", "id", "created_at", "source_thesis_path", "variants"],
  "properties": {
    "schema_version": { "type": "string", "enum": ["1.0", "1.1"] },
    "id": { "type": "string", "minLength": 1, "maxLength": 128 },
    "created_at": { "type": "string", "format": "date-time" },
    "source_thesis_path": { "type": "string", "minLength": 1, "maxLength": 1024 },
    "variants": {
      "type": "array",
      "maxItems": 5,
      "items": {
        "type": "object",
        "additionalProperties": false,
        "required": [
          "name",
          "description",
          "entry_long",
          "entry_short",
          "filters",
          "exit_rules",
          "parameters",
          "constraints"
        ],
        "properties": {
          "name": { "type": "string", "minLength": 1, "maxLength": 80 },
          "description": { "type": "string", "minLength": 1, "maxLength": 200 },
          "entry_long": { "type": "array", "maxItems": 10, "items": { "type": "string", "maxLength": 240 } },
          "entry_short": { "type": "array", "maxItems": 10, "items": { "type": "string", "maxLength": 240 } },
          "filters": { "type": "array", "maxItems": 10, "items": { "type": "string", "maxLength": 240 } },
          "exit_rules": { "type": "array", "maxItems": 10, "items": { "type": "string", "maxLength": 240 } },
          "risk_rules": { "type": "array", "maxItems": 10, "items": { "type": "string", "maxLength": 240 } },
          "risk_policy": {
            "type": "object",
            "additionalProperties": false,
            "required": ["stop_type", "stop_atr_mult", "tp_type", "tp_atr_mult"],
            "properties": {
              "stop_type": { "type": "string", "enum": ["atr", "fixed", "none"] },
              "stop_atr_mult": { "type": "number", "minimum": 0 },
              "tp_type": { "type": "string", "enum": ["atr", "fixed", "none"] },
              "tp_atr_mult": { "type": "number", "minimum": 0 },
              "risk_per_trade_pct": { "type": "number", "minimum": 0 }
            }
          },
          "execution_policy": {
            "type": "object",
            "additionalProperties": false,
            "required": ["entry_fill", "tie_break", "allow_reverse"],
            "properties": {
              "entry_fill": { "type": "string", "enum": ["bar_close", "next_open"] },
              "tie_break": { "type": "string", "enum": ["worst_case", "best_case", "stop_first", "tp_first"] },
              "allow_reverse": { "type": "boolean" }
            }
          },
          "components": {
            "type": "array",
            "maxItems": 10,
            "items": {
              "type": "object",
              "additionalProperties": false,
              "required": ["indicator", "role", "notes"],
              "properties": {
                "indicator": { "type": "string", "minLength": 1, "maxLength": 120 },
                "role": { "type": "string", "enum": ["trend", "entry", "confirmation", "regime_gate", "exit"] },
                "notes": { "type": "string", "minLength": 1, "maxLength": 240 }
              }
            }
          },
          "complexity": {
            "type": "object",
            "additionalProperties": false,
            "required": ["indicator_count", "condition_count", "parameter_count"],
            "properties": {
              "indicator_count": { "type": "integer", "minimum": 0 },
              "condition_count": { "type": "integer", "minimum": 0 },
              "parameter_count": { "type": "integer", "minimum": 0 }
            }
          },
          "parameters": {
            "type": "array",
            "maxItems": 20,
            "items": {
              "type": "object",
              "additionalProperties": false,
              "required": ["name", "min", "max"],
              "properties": {
                "name": { "type": "string", "minLength": 1, "maxLength": 80 },
                "min": { "type": "number" },
                "max": { "type": "number" },
                "step": { "type": "number" },
                "default": { "type": "number" }
              }
            }
          },
          "constraints": { "type": "array", "maxItems": 10, "items": { "type": "string", "maxLength": 200 } }
        }
      }
    }
  },
  "allOf": [
    { "description": "StrategySpec JSON must be <= 60KB (enforced by emitter/verifier)." }
  ]
}
